{"schema_version":"rtlflowbench.visible_runner_contract.v1","runner_path":"visible/runner.py","workspace_materialization":"submission_root","preliminary_submission_required":false,"argv_template":["{PYTHON}","{VISIBLE_RUNNER}","--workspace","{SUBMISSION_ROOT}","--repo-projection","{REPOSITORY_ROOT}","--python","{PYTHON}","--output","{OUTPUT_ROOT}"],"result_relative_path":"result.json"}
