{"schema_version":"rtlflowbench.visible_runner_contract.v1","runner_path":"visible/runner.py","workspace_materialization":"submission_root","preliminary_submission_required":false,"argv_template":["{PYTHON}","{VISIBLE_RUNNER}","--submission-root","{SUBMISSION_ROOT}","--output-dir","{OUTPUT_ROOT}"],"result_relative_path":"result.json"}
